{
  "schema_version": 1,
  "document_id": "11111111-1111-4111-8111-111111111111",
  "run_id": "22222222-2222-4222-8222-222222222222",
  "revision": 1,
  "chunks": [
    {
      "chunk_id": "12345678-1234-4234-8234-123456789012",
      "chunk_index": 0,
      "content": "Chương 1: Giới thiệu về hệ thống thông tin.",
      "content_hash": "9f86d081884c7d659a2feaa0c55ad015a3bf4f1b2b0b822cd15d6c15b0f00a08",
      "heading_path": ["Chương 1"],
      "heading_level": 1,
      "page_number": 1,
      "language": "vi"
    }
  ]
}
